,tweet
0,Nabi Mohammed did not eat the meat of cow now the Muslim society is not
1,US Senate approves bill to pressure China over Uighur Muslim human rights violation Infidel America did for Muslims what all the 57 Muslims nations in the world combined dared not do time to read up on Uighur Muslims
2,Just watch this Video A sick lawyer going to a hospital was badly thrashed by MP police in Betul When he lodged complaint officers asked him to withdraw amp told him they beat him up as they thought he was a muslim Dismiss these rogues SC must take suo moto
3,US Senate approves bill to pressure China over Uighur Muslim human rights violation Infidel America did for Muslims what all the 57 Muslims nations in the world combined dared not do time to read up on Uighur Muslims
4,The Mayor of Newham Stop public broadcast of the Muslim call to prayer across Newham Sign
5,Deepak Bundele wurde brutal von 2 Polizisten geschlagen als er Ende M rz auf dem Weg zu einem Krankenhaus in Betul war einer Stadt im zentralindischen Bundesstaat Madhya Pradesh Der Grund f r den Angriff Die Polizisten hielten ihn f r einen Muslim Indien
6,NHRC Police bahut saare logo ko peet ti rahti hai Ye muslim hai Kya iseeliye tumhare pet me dard hua Kya lagta hai tumhara Paidal ghar vapsi ke liye majdooro ko bhi vibhinn pradesho ki police peet ti rahti hai aaye din kitne tweets likhe un par
7,Muslim Organisation zam zam Group Daily Feeding 25k poor amp Migrant labours
8,Pakistan Prime Minister Indian Muslim
9,I don t know why the English Americans have to rename everything I mean they already have names Chappati roti Flatbread Chai chai tea Lokum Turkish Delights Atayef sweet pancakes Muslim paki
10,Enforcement agencies in India are blatantly communal amp anti Muslim The only solution is that Muslims should be given proportional representation in police This was also recommended by Sri Krishna committee in 1993 Congress never implemented it despite ruling for 15 years
11,Masjid Al Aqsa is not ONLY for Palestinians It is for all Muslims Freeing Masjid Al Aqsa IS a Muslim cause Freeing Palestine IS a Muslim cause If Prophet Mohammad SAAW were here today you don t think he would want to free the lands around Al Aqsa
12,US Senate approves bill to pressure China over Uighur Muslim human rights violation Infidel America did for Muslims what all the 57 Muslims nations in the world combined dared not do time to read up on Uighur Muslims
13,Guys this is not a Hindu Muslim Topic He meant BJP They want to make BJP a Ram Rajya Looks like he will speak for Migrants on Aarpaar
14,Release Safoora Gulfisha and Ishrat Jahan Stop persecuting Muslim women WeStandWithAsifTanha
15,The arbitrary arrests of Muslim youths is part of efforts to crush students movement WeStandWithAsifTanha
16,Muslims are owner of Subcontinent since the year 711 began with Mohammad Bin Qasim Later on Muslim Turks started 17 raids in 1001 from Northern India under the command of M Ghaznevi amp started Muslim Turkish era that lasted almost 9 hundred 900 years
17,I have a question If this were a mosque that were burned down by an anti Muslim extremist or a Buddhist temple that was burned down by an anti Chinese extremist how much would that dominate the news cycle And why would those instances be treated differently than this
18,I wanted to buy this few months ago amp realize it s contain porcine pig gelatin Muslim girls yang mana dah terbeli or consume stop okay Ade jual kat Watson s RT kalau rasa bermanfaat Just sharing sebab tengok ramai dah beli kat Shopee pun
19,UK Johnson government flies Muslim migrants in from Greece adding to the 1 000 illegals arriving during lockdown also aiding and abetting boat illegals from France We still have Traitorous MPs
20,I have a question If this were a mosque that were burned down by an anti Muslim extremist or a Buddhist temple that was burned down by an anti Chinese extremist how much would that dominate the news cycle And why would those instances be treated differently than this
21,THE 4TH REICH IS HERE THEY ARE COMING FOR DEMOCRAT REPUBLICAN CHRISTIAN MUSLIM VEGAN NO VEGAN ETC ETC WE ARE ALL IN THIS SHIT TOGETHER THEY WANT US DIVIDED TIME TO STAND ALL TOGETHER AND FIGHT THOSE CRIMINALS RT Follow 4 Vendatta
22,Every Muslim Youth is a potential threat to the so called national security of the Indian state It s just a matter of time when the state eyes upon me or you If we don t speak for Asif amp other activists tomorrow it is surely our turn WeStandWithAsifTanha
23,Y a le Fc muslim cr dit qui te lache des Ouai c est pas haram dans notre poque t es oblig bon eux faut pas parler plus de 30 secondes avec tre conscient d un p cher est une chose nier et rendre a licite en est une autre
24,Dunia muslim sangat terluka dengan penderitaan Palestina Palestine PalestineWillBeFree
25,I have a question If this were a mosque that were burned down by an anti Muslim extremist or a Buddhist temple that was burned down by an anti Chinese extremist how much would that dominate the news cycle And why would those instances be treated differently than this
26,The quest of knowledge is obligatory upon every Muslim Holy Prophet Muhammad peace and blessings of Allah be upon him Islam
27,Pakistan army is not only the pride for us but also it is the pride of all Muslim countries
28,Hi korang I purchased rempah Laksa Johor dari seller ni Seller ni sangat lah baik dalam menjawab pertanyaan Siap type balik resepi step by step dengan jelas Produk Muslim 100 so terjamin halal Katanya semua rempah dibuat sendiri Support lah ya
29,BOIKOT CHINO 1 Jgn blanja di warung Chino 2 Jgn dagang sama Chino 3 Jgn ke RS Chino Ke RS Muhammadiyah atau RS punya muslim 4 Jgn beli koran majalah 5 Jgn ke mall 6 Jgn nonton tipi Dalam setahun mereka mampus gak ada iklan MogokNasionalTolakPKI 01
30,Muslim Organisation zam zam Group Daily Feeding 25k poor amp Migrant labours
31,Sharjeel Imam Dr Kafeel Khan Amir Mintoee Umar Khalid Meeran Haider Safoora Zargar amp Asif Iqbal Tanha are in prison for fighting against the government s anti Muslim agenda Please remember these heroes in your prayers WeStandWithAsifTanha
32,d hassan HFQ your knwledge about islam is zero Ur people s only strategies are to defame islam and muslims There are many instances where ur ppl have done with muslim attire and did corruption and brutality to defame islam Wearing dresses to look like muslims many were caught
33,Ever since the disgusting tweets about Aya I don t even want to see Muslim Twitter calling out the press double standards when reporting on VE day beach goers vs Eid
34,Muhammad Ali Jinnah to the nation stated 27 Ramdan is the birthday of the independent and sovereign state of Pakistan It marks the fulfillment of the destiny of the Muslim nation which made great sacrifices in the past few years to have its homeland
35,fier d tre muslim que Dieu me guide si j en suis pas digne
36,Madhya Pradesh Police officer who said lawyer beaten up for being Muslim suspended The lawyer Deepak Bundele shared an audio recording of his conversation with the police
37,US Senate approves bill to pressure China over Uighur Muslim human rights violation Infidel America did for Muslims what all the 57 Muslims nations in the world combined dared not do time to read up on Uighur Muslims
38,I have a question If this were a mosque that were burned down by an anti Muslim extremist or a Buddhist temple that was burned down by an anti Chinese extremist how much would that dominate the news cycle And why would those instances be treated differently than this
39,Powerful impact statement from a British mainly Muslim overwhelmingly Pakistani grooming gang rape survivor
40,Jabir RA reported I heard the Messenger of Allah SAW saying Every night there is a special time during which whatever a Muslim asks Allah of any good relating to this life or the Hereafter it will be granted to him and this moment comes every night Muslim
41,I am a Muslim I stand with Palestine Because Quds is ours FlyTheFlag
42,I wanted to buy this few months ago amp realize it s contain porcine pig gelatin Muslim girls yang mana dah terbeli or consume stop okay Ade jual kat Watson s RT kalau rasa bermanfaat Just sharing sebab tengok ramai dah beli kat Shopee pun
43,I will do anything to get on a different side of Twitter as long as it s NOT muslim Twitter kpop JUNKOOK
44,We Thought You Were Muslim Says Madhya Pradesh Police as Apology for Beating Lawyer Listen to this brave lawyer from Betul Deepak Bundele He says the attack on him was actually an attack on india He ll fight till the guilty policemen are punished
45,One of the Indian TV news channels that was the most aggressive in blaming Muslim pilgrims for spreading coronavirus has emerged as a Covid 19 cluster
46,Keith is a Muslim hating American and a leader in Democratic Party frightening
47,If Busta Rhymes was an angry Muslim Can you imagine this being a trap song and then after the word crash Quavo comes in with Skrrr Skrrr
48,Indian Occupied kashmir another fake encounter and an excuse to bomb houses and drive out the indigenous Muslim Majority for the Hindutva settlers to change the demographics
49,iRFANsh
50,Yes and as a Queer Black Muslim a lot of the f cking Muslims locked up are ppl like me You re complaining about them being romanticized even tho they re criminals while angry queer Muslims aren t accepted If you don t understand why that was an ugly tweet I can t help you
51,Time to stand strongly against witch hunting of Muslim Activists Release all Political prisoners or be ready to face our Resistance Remember Sab taj uchale jayenge Sab takht giraye jayenge WeStandWithAsifTanha
52,Foster Absolutely brilliant one on one Craig you are a pillar of Australian multicultural society Thank you for all you have done for human rights Muslim Australians and gameover
53,The Delhi police have now arrested another Jamia Student Asif Iqbal Tanha because he was an active participant in the Anti CAA protests Witch hunting of Muslim students is going on even in the Pandemic WeStandWithAsifTanha
54,tgt RI Dan anda gk usah memperpanjang seolah2 hanya yg mayoritas Muslim yg wajib diperhatikan dan yg minoritas dibiarkan jalan sendiri Dan gk usah bawa2 umat Islam Keluarga saya pun ada yg Muslim Ini Indonesia milik semua bkn milik 1 agama saja
55,US Senate approves bill to pressure China over Uighur Muslim human rights violation Infidel America did for Muslims what all the 57 Muslims nations in the world combined dared not do time to read up on Uighur Muslims
56,US Senate approves bill to pressure China over Uighur Muslim human rights violation Infidel America did for Muslims what all the 57 Muslims nations in the world combined dared not do time to read up on Uighur Muslims
57,I have a question If this were a mosque that were burned down by an anti Muslim extremist or a Buddhist temple that was burned down by an anti Chinese extremist how much would that dominate the news cycle And why would those instances be treated differently than this
58,He betrayed Muslim women through a dastardly Act in Parliament He bungled up by arrogantly sending Indian troops to fight the Tamil Tigers in Sri Lanka He was not bad at heart but stupid
59,Muslim social worker does last rites of elderly Hindu COVID 19 visitor in Dubai
60,Powerful impact statement from a British mainly Muslim overwhelmingly Pakistani grooming gang rape survivor
61,Muslim social worker does last rites of elderly Hindu COVID 19 visitor in Dubai
62,All governments both Muslim and non Muslim have a responsibility toward Palestine
63,Watch We Thought You Were Muslim Say MP Police as Apology for Beating Lawyer Deepak Bundele speaks to via in
64,One of the Indian TV news channels that was the most aggressive in blaming Muslim pilgrims for spreading coronavirus has emerged as a Covid 19 cluster
65,Stop The Revengeful Action Against the Muslim Activists WeStandWithAsifTanha
66,Sangat disayangkan Negara dengan mayoritas penduduknya adalah Muslim namun di dalamnya diterapkan aturan yang bukan berasal dari Islam melainkan justru menerapkan aturan kapitalisme Di mana materi adalah segalanya di atas agama nyawa bahkan kehormatan manusia
67,MoDal This man is named Siddhart Rai He does job in Dubai and he is talkative about Islam Muslim speaks dirty words about women Please take strict action
68,ka son Arnab Oh bhai Shah Bano ke favor me jo court ne judgment diya use null and void kar diya Rajiv ne Muslim Women Protection of rights on divorce 1986 lakar bas mere appeasement ke liye and phir ramjanmabhoomi issue ko bhi trigger kiya
69,how old were u when u did it for the first time i m a good student so no muslim so no 5 14 not allowed to 17 reply with emoji and i ll send u questions
70,Delhi MP sends list of illegally built Mosques Muslim shrines Madrasas and cemeteries on govt property to Lieutenant Governor via com
71,US Senate approves bill to pressure China over Uighur Muslim human rights violation Infidel America did for Muslims what all the 57 Muslims nations in the world combined dared not do time to read up on Uighur Muslims
72,wkwk temen nonis gue disuruh ngedraft ucapan selamat ke one of the most religious dosen muslim yg baru punya anak
73,This group is sponsored internationally by Iran and other countries like Qatar through the Muslim Brotherhood Trudeau thru police forces ignore it in Canada because of donations to Liberals by thse radical Islamists Democrats in US no different
74,US Senate approves bill to pressure China over Uighur Muslim human rights violation Infidel America did for Muslims what all the 57 Muslims nations in the world combined dared not do time to read up on Uighur Muslims
75,This is not a rocket science All ancient temples in North India were destroyed by Muslim invaders Indian kings were defeated after a long battle and multiple attempts by these invaders These temples deserve to be rebuilt these are our including Muslims of today identity
76,The arbitrary arrests of Muslim youths is part of efforts to crush students movement WeStandWithAsifTanha
77,iRFANsh A be bhosdi ke supermarket ki ma chud jayegi mahamari me wait kar
78,Slut shaming muslim sisters who have not cover their aurah properly yet
79,Any IndianMuslim with a Spine amp a Voice is Liable for Punishment Only in Indian history Pandemic will be recorded as Witch hunting of Muslim Activists Asif Tanha a face of anti CAA protests has been arrested by the Delhi Police Release unconditionally WeStandWithAsifTanha
80,Pakistan was created during the partition of India as a Muslim majority regionIt is an ethnically and linguistically diverse country PakistanGiftOfLaylatulQadr
81,educational for the less confident and deen final call to every Muslim women and man should they understand the clarity from ALLAH
82,The arbitrary arrests of Muslim youths is part of efforts to crush students movement WeStandWithAsifTanha
83,Living as a muslim and dying like a soldier is the wish of every Pakistani
84,Hi you like to send warnings to Muslim families in case they gather over Eid yet have nothing to say about these gatherings at the beach today Any particular reason why
85,Watch We Thought You Were Muslim Say MP Police as Apology for Beating Lawyer Deepak Bundele speaks to via in
86,Why did these Cops in MP beat up a Hindu Man mistaking him to be a Muslim man just because of his beard The man is a lawyer his name is Betul Deepak Bundele Did he deserve this if he was a Muslim
87,The unending witch hunt of Muslim scholars amp activists by slapping charges under UAPA against them is to crush the dissent FOCUS on dealing with the COVID19 crisis instead if you are sincere with your people WestandWithAsifTanha
88,US Senate approves bill to pressure China over Uighur Muslim human rights violation Infidel America did for Muslims what all the 57 Muslims nations in the world combined dared not do time to read up on Uighur Muslims
89,US Senate approves bill to pressure China over Uighur Muslim human rights violation Infidel America did for Muslims what all the 57 Muslims nations in the world combined dared not do time to read up on Uighur Muslims
90,Satu bentuk dukunganmu untuk kembalinya hak hak terampas para muslim di Palestina oleh Israel memiliki ganjaran dan pahala disisi Allah Swt Palestine PalestineWillBeFree
91,US Senate approves bill to pressure China over Uighur Muslim human rights violation Infidel America did for Muslims what all the 57 Muslims nations in the world combined dared not do time to read up on Uighur Muslims
92,n D accord mais sa veut pas dire qu on doit les insulter ou les maltraiter au lieu de transmettre des messages qui pourrait nous faire avancer dans les bonne action je vois pleins de muslim exprimer sur ce sujet et souvent en insultant c est grave
93,Watch We Thought You Were Muslim Say MP Police as Apology for Beating Lawyer Deepak Bundele speaks to via in
94,villette Stop your illegal wars on Muslim countries and stop displacing men women and children Bombing people out of their homes
95,muslim HFQ People asking to ban RSS have you been to their lectures or seen them work
96,One of the Indian TV news channels that was the most aggressive in blaming Muslim pilgrims for spreading coronavirus has emerged as a Covid 19 cluster
97,kate Leaver Tom Tucker cooper alabama doc not a bot 45uk Vaporium rss the Do you deny the existence of the mainly Pakistani Muslim Grooming and Raping Gangs
98,Duh bikin malu umat muslim Udah tua bergamis tapi tak beri contoh malah ngeyel marah2 arogan ngelawan petugas Bukankah bulan puasa harus sabar ikhlas dan tabah
99,WeStandWithAsifTanha Every person who joined in the anti CAA protests and saw the beauty and power of reclaiming democracy you must speak up as your fellow citizens and Muslim student leaders are being made scapegoats Act NOW
